cuce,entidad,objeto,fecha_pub,fecha_pres,estado,links_archivos,links_formularios
25-1346-00-1624209-1-1,Gobierno Autonomo Municipal De Cocapata,Const. Sistema De Riego Calabatea,31/12/2025,23/01/2026,Vigente,"['RFE+0MTTgGfuEot0fJPmRQ==::ancAhbl7bLJ8hKzV0ERFjqXDaarW5FMkG59hmnUAbCnV2RJYYSodk1TLRRBspj6/nbSX0A/JXOmZFu5rPVKOPQ==', 'JOMCdAPae9U76f2KIxfftA==::Ueoi7j+9/Gy9y++9DKEJfxtwiBiy5AOYiVOyKsr3G8ZucGspXTIWVVhxTRRGb0pXUDGTrnnhodSuPlFfhZ8uow==', 'E0WbQjV8AMr2KB3O5XTY/w==::Gsr8HttKd+d2Pa+sw/rXAOD3P4aUKRvsthdZS/7DJm3TW12SXHgwWWQR3ZQxT5zPR9dyiEjWeE2Gvo2eujb/xw==', 'Pqq/LXVkZsN8G4/pbmq7ig==::exM8aaKduKMJErIMyqaGRc5dkin0wWoGWhcOILsYJLrERWDeKTIrnDuf65kTG4tr6Siw+rlFO1n7GW6/PsJfVw==', 'VmaPYVZ2K61bH/ANhv7ChA==::JqLhsV5HpRwubqGrZ4OrVGESKPYo1cwotZ8tgklhX7RmtL7xRInqIfl2fxV/oLM3DBll+J+Wkc9YW/DB2ycOhg==', 'WqpaSVmzjZtpOZpkB3O2Qw==::o5SVQtMRyFh4aMukDYq1QCR7ugXkrcFMUok/VAftDplgxslic/irn2+dzsAILWBAm/6LA6QruYSdVRAJqo0hTA==', 'W7xRfJYY+FRG6duII/mrBQ==::djEXGoBpI6ozcBG1TU+kJ5wght7RR1BafAulnQvIut4SgGDgVzG5V5ipqLJTDAimFIUEX0DH4ucyFUNtkpCTBg==', 'AoVgAgtYX8cZCNb8JdP62w==::7IQavWrjNEap5WR8kwPY9zBb4fH9dC4esJxlnMhs2Ef+/pr1HtEavBdMZc3ZlSEm3JQqR8hu6mqqdKz7QAFPRw==', 'UxGbFuH2klUqJwT0FRjsDQ==::R/+Opb9owpdOrGHXodP8NB7MHUSZJQI1evFJAyfu39D+oZ03+ZZ3w7nORbT8v2UsvY69OyiblU5Yti69oBrEOA==', 'eMwvOYSkkbyfNIrOp5JI5g==::JGIUb6OwPQHnniEtrBgsEp8v9ljp34gPe2KpY0yEZX23qwHKkTiCGedqyjCor7+aEAkfPDfxbrz4xOQZQG3bLQ==', 'IxpgNhR1vA0QHeLiVJURZA==::HPPOKWceZLIVmlxuQV2o2Zji3squ2dA1t/Wr1tMw+Mh2unDRYqaUaw4gffI56CjbgEDC85zStDfLOhW+8nazJQ==', '8gf35hCQBP/+lC1LhDYP8A==::zb56zmlDyZHZr/XrkuiaAbeLV1t8xyiQV9QaXXzneJZEQiqDYaURakg2Rw364a2L0VuG3B6SQFtQbl+b2RpU5Q==', 'ciT9+X0pmgE51RYdcZGifQ==::chIU3v1pUZCE053A3FZCtKDFt5pLIZyWkMZrCx+hWRfFZNmlf4SAH7HnL7SAgKFZ']",['nBsmS+29DoKOb9PX5zLlkQ==::q33vEaBCSWZq2Fn/whNtTI/Ib4grxQRagd+xngKFk49B05JZeCXgHyC805/P3Dh2PL0fzlkL25W4kcxnFSbhlA==']
25-1530-00-1624317-1-1,Gobierno Autonomo Municipal De Uyuni,"Alimentación Complementaria Escolar ""Área Dispersa"" Y ""Área Concentrada"" Municipio De Uyuni Gestión 2026",31/12/2025,27/01/2026,Vigente,"['8gq6yZo5zLN84h4jOft66w==::6e9P0YrOxFy6rVL0mz1pzolonuGb7GEC5Xeo8ZNn9d0Qqo1DlpwE3yEkWDtsv4lGCTHnmLNcElYu7ru0QqPJkw==', 'Xwttbgq8pFcwCkw8xGRlEA==::mwxG7Yh9SlCROjeUJKLXUI6tgLSiafIOvAVAcAcoskFTlaKGe2to2dIefpINIitzhWqtdhWLzN/MJE3O2TNjdg==']",['HuhCwyl7Tlf+l8X2tA+wpA==::afOm/Gl0tHUYXvnDXAomB0xPoZhAnvqNmoyy0CyEd0qkNllDiel7NWf28Qb9FjZ/3/MIGZ6Xolciv5e3Gwi5XA==']
25-1101-00-1613852-2-3,Gobierno Autonomo Municipal De Sucre,Construccion Pavimento Rigido Av. Bicentenario Jv. 27 De Mayo,31/12/2025,14/01/2026,Vigente,"['JKmDgn0ExpkGOY/0NdlYAQ==::IjvSriAkTV4JjXbD55Y+8aRXhyi4QTpZWHty3+cjmtm0xGLkgLoyNSzEYACvOjg67MzKY6UfqGi18q+xdNRwaA==', 'EAwWMP2Rggg1F3MwOOVi2A==::4nePLKbtwYDaLnILL6OSOWQ+vUKCq0e8B1NatuxmOB+D6BJIUBhCbjedb1yS6oaHiaI1LhSGk+43RRNILaUauA==', 'x/0QMdnqTTj2BMT5/34L0A==::78Zv4Or10ZZwC+W8DQyB3mduZ5svUNNRG2nhtD3sYp/0wEDUZx/WJRKY2HMl7/P75La/bCVRUiOoKqV86jPMOw==', 'kVaYuIyjm/8hLgJkukfcCQ==::xyRISD+i+uqaODt1zdJfgaoNMLdtzwnhqvMqzO91ZSFt0dz/jrIl1wchbNlz4h8cae3bboVnWgz9zGjkBvnahw==']",['fMTGbWSXTsBoYyx9MgJUwA==::SE5HlX7jMyDrC0K+NMB/qlzzeu8Cm+LRV1t1TzuaP4AshenXZjXnhj9ELwWsbCklMH+wziwnqxvtv3mzKQ9c1Q==']
25-1301-00-1624414-1-1,Gobierno Autonomo Municipal De Cochabamba,Adquisición De Madera Y Puertas De Baños 210-0000-034,31/12/2025,08/01/2026,Vigente,"['ki+Nd0jduZ/aquv5mXr0Vg==::nISWqinHJOeCGCeeJj1KQF11CMwzSiUSna08uJMGAz2+kQEtHaO3rY09BKZmJYawo8p+GKV7zIzn19BYiNgsUQ==', 'gTZId2aprHAsmuElF0NwEg==::puCjKMWZGIuGyUZplDxD+lTL2QXtEl1+zCUECePcfJjSeiJqqKCXs67SwagkuUZVOWDdY+h9EKGLEk0HUG0Dbg==']",['JpyZsVClmVwSH/59P0fGkw==::TIkOErYqUYEPCpyJmXktVOABgdlfltkpgd4VBpldzHmyzAOKZc9gVxpulQCXuyDcD8Z02aK1VAqXwEmiHdxLTQ==']
25-1301-00-1620794-2-1,Gobierno Autonomo Municipal De Cochabamba,"Servicio De Mantenimiento Medico, Laboratorio Y De Computacion Para Centros De Salud Integrales De La Red Cercado Gestion 2026",31/12/2025,15/01/2026,Vigente,"['w8xVYHXa86RDc4jGAjukjA==::Hk6SghhMTuMKAqoYQ6LMgMyFEpD5Fn6yhZeg+ig25bzcv1KtoIvAKHtGb/9z/T65OvT2eXxSfQ71rXkyKtMhew==', '8w6Qb6hTZLh/pYLu6AHY9Q==::w03orCpGHmo/maBEOmL9+hJ8q0KZZyg4Jm9th2QjTFDzMT/WPRIetYoC6tKyOYU64pFh744I+c69yGNYC6F0lw==']",['2GpFNg26aci6OyFVf/U2tQ==::UXaKb2yX99jo12P95MxGWIPUMvD1u2UbIL8lg4j+4ueVzNQzf5zBpRM+frFNvrU/eK8PSGuYAHy43th7vdiJ5w==']
25-0904-00-1621340-2-1,Gobierno Autónomo Departamental De Oruro,Servicio De Fotocopias Y Anillados Para Unidades De Funcionamiento Y Programas Del Gad-Oru Para El Primer Semestre Gestion 2026,31/12/2025,08/01/2026,Vigente,"['Uzb5kBJLYSXDmhLZVqdcyA==::Z6hZ8heumabA9QRIIKFbB0BGwe18z6dGdxYdfn00QoqAObrOJX6hL0urSmXTOY5CoCZrLfC2iutlgFqYyYuVCw==', 'CeqUg1B+e0AU/anKxvpsPg==::neIUQiain1PUKh/ThpWh0jCZLC1hyZItsDUubeCQpXNKV9aT6ITrhK3PNHBeflCIaeibg194HOTNbInmQvAd9A==']",['RtPHkGeJ6YwFbpOvkiqWog==::9a6RC66+zzsxwWdcOs+ejTA8dtzqX2LYkNOZ90WwjBnArNuCznH3aTKqSDil5ljqMlvfwk+xBglxh9IycE6FaA==']
25-0046-31-1623986-1-1,Seguro Social Universitario Santa Cruz,"Contratación Del Servicio De Laboratorio De Análisis Clínicos Para La Atención En Emergencia Y Hospitalización De Los Asegurados Y Beneficiarios Del Seguro Social Universitario Santa Cruz (Ssu) Y Para Los Estudiantes Del Seguro Social Universitario Estudiantil (Ssue), Gestión 2026, Con Cargo Al Presupuesto 2026.",31/12/2025,14/01/2026,Vigente,"['Cnfp4Dsj3t3OFtERCuJ/vQ==::UC2wspVS246iMt67ny0WbnEbQVe6KZrOucZFLqaKsyKI0D7xG4fNTMN62YjmYbvamByib6MFLXA/HvhGVUsqfQ==', '+wH2zFnJtFD/yCUFGosrhQ==::HRdqXT1Yh7lvG0ujvW5TD+HUvqDGk7dRJeLbqvaLh2OcYoJ8pK/i83lXedVyNU6/DctpYlGHF8003wowGjifjQ==', 'wzVn1FAs+QUBtnYfBGuwtw==::YGPwGST4eIqJLGczGaHMjXxgrihlOJwnqgFF/tB6WBUfSxjXzNfIoeoc8HmCG+brRUha4wRZUgEB96VWVU2pXA==']",['LZJjntvci25F9Fn9zm+gGg==::GPkbapYfa/VSX4OKILFUVdaI46Svys9s4lZ3MplW9mmPdbcm4FPjHnhv7CeLzSQ9tQRM1UQy0CBCPXWw2StVcQ==']
25-1745-00-1624405-1-1,Gobierno Autonomo Municipal De Ascencion De Guarayos,Ampliacion Unidad Educativa 27 De Mayo Ascension De Guarayos,31/12/2025,09/01/2026,Vigente,"['3quXTZXsTnbdtoLVgBKlPg==::YXfj6lnsB9rLcxjVO0+U/CZqCvq9EKjOms9R6Ws8LknpPgjnu8/hG8wi1Z/y1v0Dw5OI1O/8tZdbKQa+euBmWw==', 'I3doGsUTTX4NdhCMaSB1rA==::Kn4HjppoVu8Z2vBsDQvCXh//BkknP3DBknLrBj9WRiLo2R2/lPLikccWzwRAVRAcRDwSjeaUq+rHpjILAIhfaw==', 'pYT0Vt11hY7Cwty220grwA==::g2ueD9rJ4K1+Xk5646B5UITUCsDOhICXH51ux/d3MurdhjQeUrR30lrCqLJRO33Ru/u4f2yE0ycVXHi+QImeYQ==', 'aGA3gJiSW2UbLKuUweR3Ow==::oq7PqA/fCm/zAnEp31solo9Xr01k+uCnIIhGqa8a3DlsF7Z5GCCIHFMGTsSmK+KvWuXMA6FPwsnRNA1L+vpkeQ==']",['a6EJPwGuvMa91Bi1QasOYQ==::arl1bkv9F8n51BH0MGTYXqQZ/4no9L70g6Z94x5ANL7JcF3om7zlbkxf1+9hRPBhdx+90Kj5O6bxxJAGsbvpng==']
25-0903-00-1624395-1-1,Gobierno Autónomo Departamental De Cochabamba,Servicio De Atencion Del Estacionamiento Vehicular Del Gobierno Autonomo Departamental De Cochabamba - Gestion 2026 - Item 4,31/12/2025,07/01/2026,Vigente,"['ILRFQRFUP8TgBPUl2hVS9Q==::xSmWe3EAqc31fJaBJNjhfBhHhL33phyDJMPu+T2I4ZpkTWCrDiP57v73D+yFVgnrB/nyJOxPeQqpXVhPotRz/g==', 'n/bM1LEZZ1Ax2uv2DXWDyA==::gGqxvsCAe803HC7irbtK7f8Ntvot5FufC3fUlbVK8W+lPhy0B851aGjkTnwZamTVeIAOKeVs1bpJUNNEkBMUdg==']",['bswrimOMdSlYK9SSPYFAAw==::MIjYLvxSZ9pE6i5RhJwoT/ocmiwUAc0ErJnfbAy4UxUz71K/BnzinQcEJnp10AGBfv225r4xagzt1BvMkRmLMg==']
25-1301-00-1624403-1-1,Gobierno Autonomo Municipal De Cochabamba,Contratacion De Servicios Para El Mantenimiento De U.E. Municipio De Cercado (Subalcaldia Itocta Y Tamborada),31/12/2025,08/01/2026,Vigente,"['6HnZm+37alAyOB5kXhPIUw==::fHE+iUNk81C1V5LmRQAECFwUW+pHxZMZKvZanCsn07jybpeXFryTN9iaVye0g8b2EbbyAygCyinNylca65O4hw==', 'mtdsrShwSRsiJvc3ERslIg==::+SyLj0HzL+sV3ZkWPeZIEyHp22infdFSPB38rl9bA6K9mb8LUIVSjFWtfxT8/qQ5vrSCFuVnEGvCVgD9c6M8+A==']",['OTajrhVK0GR/6C1YlHfgSQ==::ztI/TsgeVk+wlAG2wm2VszP+9YkmHXXL5x6+8Qmdtx9JXZbQ+rUAjIdjzTpvTR4p8vLshp19vp9JV6qCh+7FJQ==']
25-0340-00-1615007-2-2,Servicio General De Identificacion Personal,Servicio De Limpieza Para Las Diferentes Oficinas De La Direccion Departamental Santa Cruz (Gestión 2026),31/12/2025,15/01/2026,Vigente,"['7Yk0SkztDQqcl3TC0IlAcA==::3jidfWS+GWDegiSBqBF/RoQ7oTVo8qcz6TXl8XJzQx25f6IX7WqRac1IBtaG5uBQM6FWeYfLeDsUA6mWLoLL3w==', 'ohoFxzxxhodradqNLGTtFA==::RXa+eJA1jvi+pUzaC4ypulNrhuBW2CEN84qWY7pelRlMyr+7G81ShBHenP/nIWO3hGvDrW0yYisn3qRzvjIRRA==']",['xVhU+QaIQ2sGIvJl8ymZNQ==::esKdFLqha7/QY2wKj9sUpSfPspRvZoMeuyT2vtDP0StRkAR5eLkwxdFdDPKSFK5X0u117ENvdgeWmiwJjsYkEA==']
25-0904-00-1621793-1-2,Gobierno Autónomo Departamental De Oruro,Servicio De Limpieza Para Ambientes Del Gad-Oru Para El Primer Semestre - Gestion 2026,31/12/2025,08/01/2026,Vigente,"['9MOgMwAVB/23Nzln3l/gUQ==::hUEWxEbI8WEcvA8SxZFSAqmT4kLt/CS1sah5V1hND9ZvOE+GoZoQW3vdicGst+AG2tbkfjC7+I6IJNvwKQpWig==', 'guJCw1oKItyQVfWvPqT3/g==::cw1Dsmhb1t1Ll5FE9HxWDmL+/i91UGGgcuW4CrBEgBh7vgRjDK0SHcwjJhOZh2W+CRuAR6pQ9cNHXMJnLRhWjw==']",['F2l7OBRSLAYK6JFuS6qiKA==::7ovibGeaJYsevCN4qGJGdP/MPbxzoPQGgQGwdIzC4QI3xdBmPr2X3cVSp+yyWtBNer71JIEfewxjLM+SPmLgvw==']
25-1710-00-1623945-1-1,Gobierno Autonomo Municipal De Buena Vista,Compra De Vehículo Tipo Furgón Para El Hospital Municipal Roque Aguilera,31/12/2025,14/01/2026,Vigente,"['teN47lp05jq8xtJCuHfoYA==::uVmYXJJtNzrwklS72m8dCd9PM0TCN7XgRgnETYFpg/FDHsHPslntN9BTgj900vFT4a21VXU4G1Zc/gzL3cGIXg==', 'mDUFEFdAnFWB/10A4EnFOA==::8CiWfzStRDZGSl+YGz8/v3ArSdyiXn0ClioPZZwDou3Na+sLiXbVUTqo8bxqVeyt3+oDYdpMpfUmsC6Klfr45A==', '6FCOQM4Jt78799wqIs/DDg==::IhxvQp+re0qDgHqhTaU6SBpnoFpv4tozko+DEqhsbMC0eqrZOx8+VAH07RFuhjw+eNsWQ/LAZG9q9MqGO8KdWA==']",['STTMVgv81YfJJDUU4/2npA==::F8L+zv3X2QtoNxDB61v/cHHbIYqk1mluRjzqpApr9MdQvgCe+YXt10BiA78ohqhGf+7QE8ro6pThaSm86DHWkA==']
25-1126-00-1624303-1-1,Gobierno Autonomo Municipal De Villa Vaca Guzman,Const. Pavimento Rígido Calle Final Germán Busch-Zona Terminal Vicente Claros (Muyupampa),31/12/2025,23/01/2026,Vigente,"['2f6TQ+tWbhU+xn2U68ARqg==::oYima/RpCRFmz2eIvE01iPydAA7I6AfL4Si5ru41x+N0eJAmu59i6QkQ6oaheSAxFh/1FHaKajFVoD5bXPjd5Q==', 'YbvWLJhkxqjygnCoDmNi1w==::Faz+k3PSHlmF4tfgDSgZQQ+S5E/vSi40cOWeGN7aFjjsmnPnGQz+hne0wFRKWdjLdGNQezoZfrYmfDuD3t7aKQ==', '5By16StkuFuwbVczhOC0lw==::YQo75PxOOdy4rws6Nkz7QzoxFtCaLcp0yhdsgYmOtQLkXUTynzAlVAPDGkNAoJ3SJNcrq5oXcdWoyIPSFRxXFQ==', 'hQ3ZcXJSWX44DC3RsuEWqw==::9mJsAWI9a7Et4Fb8STjLNvC9jKcZfNSwSF/bYmm9AJek2NrlcmTzOTtsMOHUg53831ULBBObV+RfpKTU1tnZlg==']",['MZKchxBt0R2hu+V3DFxBAw==::AhD72e+D5KIwXtg6Xcra8+F7FnSG1aJA8KsPP/RW8/bhxKcSyrOPaFpqNbW7v3/9E0TDiCiVsnj2pn1QBe8uWg==']
25-1266-00-1624296-1-1,Gobierno Autonomo Municipal De Coripata,Equipamiento Medico Para Dos Centros De Salud En El Municipio De Coripata,30/12/2025,13/01/2026,Vigente,"['Le8yVEaUHlcm+8m1wLFhXw==::1jJhFdj5g0dJcvNblNjYrQ3SM+tWJbIhz11OEYWWdCamSSfeMZSXUhtkvvygKMUI7yCX0MSpYFmR2/gRnv4OjQ==', '1J1VhoYTEiOVqjcRhbsUGQ==::APQxePihlwfs03UGaL/WIdXMS5brkZNpVoNVDQ9FaIcWxgyFkDLNXitWJmdICwbabeZtIkAmxwI9U7SPz/fhDQ==']",['ofw8RyDHIkoJSA7U3WqLrQ==::H4A6AqncyLpTZ2V7licTpZKy/4X1gxnM6nGLs2OjZ2Rq/D0dhhmPW1Vh26IYX7aXcCSfCKRBZuG73b1s2VZD0w==']
25-0283-14-1623951-1-1,Aduana Nacional Regional Oruro,Contratacion Del Servicio De Transporte Para Personal Dependiente De La Administracion Aduana Interior Oruro De La Gerencia Regional Oruro - Gestion 2026,30/12/2025,08/01/2026,Vigente,"['0zHFa0t3SfVyWUUGZ4+RrA==::7JSy0G19ZT3W0gvtkkvNgea4+F4bdFh+ahZmr7rRUNVqJAT3HyDLFiIdx1GGn+pCEYHVlDNhdCrX8gV0RCG4vA==', 'ZiQ3CuK4N16Jjid8xWE4uQ==::UXdP2VXWKCQDlyEUtdOcyjabLQEjQ40lIoTNueBiJI/MqC/xfiws91ss6GCqs8B4ca+8sNXvVm5fv0bnCYtVeA==']",['lmDmYHQQ7kJq5nFiLYFc1w==::dNukP4kaXuUFLOloQJcNfMvUqa3tsBbNxVyhbNK64sNj4IsMeNewCqJHXygr9EWPfS3BMwkwLiuEK+spe2Jy+w==']
25-1704-00-1624284-1-1,Gobierno Autonomo Municipal De La Guardia,Servicio De Mantenimiento Preventivo Y Correctivo De Vehículos Y Maquinarias Pesadas Del Primer Semestre De La Gestión 2026 Pertenecientes A Obras Públicas Del Gam La Guardia,30/12/2025,14/01/2026,Vigente,"['/FlfSqckstF9xBC5ZYHJRw==::cJi2IR3EBYUcEtqK2lju8tsC6xVzjUaTfrtlURAyprWl5+7lm4EE4yDflXMftNcIpDkTw1Inqq2bg2zfke7ZIA==', 'dvjnF5BMDqEKFZzuOokR1g==::CjJhcZEyI67YPub+xfVXIIJo5iEO+V1/WPaKuoMzClSIBHzPDOWRhW2jXwghvIwydeZ7zxxnI/nzrifLdti/ZQ==']",['qAD3B/nzUd0b389UV/Jeqg==::dxRDmz2VloNb//xqH1dOhRg3ifJwwAsSpg6LG8YHRouAnb5R3NS5dex/Djgp0XBArU2pnz7IToOlsRI6YDZCFg==']
25-1346-00-1624269-1-1,Gobierno Autonomo Municipal De Cocapata,"Compra De Materiales Para Refaccion De U.E. Chiaraje, Camen Pampa, Chillavi, Cocapatay Icari",30/12/2025,06/01/2026,Vigente,"['suZjljLAu9qdCtsPcW2EXg==::JOsk6SQ1+mInzXCPZihEF6G6edlSF/zw+isTUzS24R1oyGuKBPSu21yr3w1AIts2vaIkDRviKgyt3sbJuvDJag==', 'WsVdENSONlkShqR8euV96g==::Y2aIp1QO7ItnxAFh1JdpfYeDtd71QBXfauz5GmknFkP6iFXTywEbrRdL93kTZ8HMz/QBBuD7cXYEsikr46pyUQ==']",['+D9KDkxnpoOPrFR6p0TW7w==::s9XkxgcsVF369ZgxOG4tPSaAKYcHy0+kyztBb8OsmgQ/NIwAXZKDoogs8XiYckMoxNmUJ5nW/V9slH6L/CjN7A==']
25-1331-00-1624279-1-1,Gobierno Autonomo Municipal De Totora,Servicio De Consultoria Por Producto De Supervisión Técnica Del Edtp “Implementación De La Gestión Integral De Residuos En El Municipio De Totora”,30/12/2025,08/01/2026,Vigente,"['GlOETJlHl4czUc53eDgJig==::wPHzPUkU8lXfMNIQrXryA0R44g13ZmF13xGF94bOf92+rC3y83CKEoT+gm94aGVXVqn/5oBq6KUEHhej5+0PTg==', '0IVN6nSMcmcQFlHEi3YuXg==::A6wisY0XPwX6xc6qFM/V7jS2a7v3xYRUnPHROgPYn9x/bb+mrloNnmozBg4jQ1t9GOYvbVdNxBZRgl1fcWn2Hw==', 'DQCL7ma50zN5QweoogT/Dw==::2unigvALje+6xbvSYOA3F+HXHGDvjcdCL6+q08RO+B1G2jxLsAApSjTJ0j4BWa3hr+sWyDJhMzG44cHqGrXfuA==']",['be3F4exW98AtBX/8A8IqHw==::RMcbiv0FtHJnBgxYYK/TN/sZbtSko5a2T307GJ/r8HsbnuZM25HUn9gDxz2E6LecvsFKxjwSTMmiufJdXpCnNQ==']
25-1287-00-1622223-2-1,Gobierno Autonomo Municipal De Chua Cocani,Alimentacion Complementaria Escolar (Gestion 2026),30/12/2025,13/01/2026,Vigente,"['k6Jz5VJPq14Y1RATX3dxTw==::vX2Hf1LZO9i3BEMYAET3vKBtR0HY82IWNdl8kYrtXF1HkVCP3VZDzW8ZvV4GjsWxZBonIFUmQU7AXGpxy2ZnAg==', 'y11q7+mFpSnUT9QQBvhTGw==::zZx99mAPTGgw//t8SHLdbfvNLCPXKur/z7OVM66L3Yf0XJ3YQP1DFCehBc2L78FtFbtjS+T0PF2l/zL+rPibmA==']",['gXHxup11iXGbaO75wwjFgg==::0506TtMEjop6Pesr5PQamlweDj6/pOdjonm+doX137Jecqo0PYFOTObtBOHEFKRmzhWm8c5YIMce9CoU0d3BuA==']
25-1431-00-1624153-1-1,Gobierno Autonomo Municipal De Sabaya,Contratación De Consultores De Línea - Personal Del Area Social G.A.M. Sabaya Para La Gestión 2026,30/12/2025,05/01/2026,Vigente,"['4xFMIl6JxY+6lxnJL+iKvg==::GKTXOh1X9cr/UV0gSr7PkjdC1Yyl9u2pTlTgmzU9h0Fcun0sl7YvQEv524xUTrbky27HbeJjCV4D+cj1A00cEg==', '2eEOKlo32XuPv1IbFIClyw==::LCLQIKn1MQCWW3z4MqdSF9heczYT91WQTqgl3DKkXIbPbHabqncBuwK9sRByTH1s5izIdTtjVaDIMvKshppZDg==', 'viPhA4RHrKth+cQwVW9d6w==::C2INIBpmIRc61AgTBercVWnqI+HBpkp/ECoEK4VKXYqZIUw5TntAwAevaI3Rv9+tTun7NiFmK3LZbleTHqSCTQ==']",['CULFHf2f20VHQfVUtLADLQ==::HGsfk46q18v9cTYLLqduDDUNOsT9fd6GcRGadetptJrtJ3eOUonLXsO0siMOly65scDVNAAG2zCINVojkX9UqQ==']
25-0831-00-1624226-1-1,Servicio Local Acueducto Y Alcantarillado - Sela Oruro,Provisión De Ropa De Trabajo Gestión 2026,30/12/2025,07/01/2026,Vigente,"['kcImyfKrEhKwFK2J8Ltltg==::gmy8l+oi8rQRyzsd/883zo4mNocHzlj7khlTpIPYIjgEX4Cm8XrUPvkDxzqQUvTxyJ8jiZWZvn7T8E1UEZondg==', '1iThDggT+uPazCYZTDiouA==::lVAzLp4WKaF01RbISd8DMHMyVKYOH1up2KRbKfKGuNawoQeQcEBAVHc2ETUK9fkxN0hP+FKGrN/TrRql/eosvA==']",['85Et8Gb096B+s/3BLZOv6g==::Yhurb5h+b+4Kswy/gAQ8VYYCo9X0uIgZ3rZbn/DSzvKeNPsEbmIYeq6fWH360LjT2/JfT48gD4IgHz6poB+LBQ==']
25-1331-00-1624256-1-1,Gobierno Autonomo Municipal De Totora,Estudio De Diseño Técnico De Preinversión “Implementación De La Gestión Integral De Residuos En El Municipio De Totora”,30/12/2025,14/01/2026,Vigente,"['0jA31lIBFfMQVTQDBKq+eA==::XHHUckQ7sWGWwtIoAa6i9HC6/rO/vAzbmz+GjTCPUqa4MXaX1A6MbIMxqCWj+M9oZpoBrdmd5fAKRA83UGVrrA==', 'cfgkFlVI/5Iq6DX55ZGw3Q==::QRy3kJ9hh3H0M3QM/c0S0Pc2V+X8A8yL+FSRx2pFrh3n9ffksBSh93EMIS+H14IsAGEbuyVsbmoggmWXemwsTQ==', 'WOrBv3Xfofx6DV+0wZNTCw==::1Q1CyNwvf4/BaD2f3ZdMtt21g/fCXVB1VPpOk40VcBIkdxOIuhuZ9U2AAiWz6st1gqmtIldX2gYDJbZ6ZyIWjw==']",['LG7GQTW/hbohedwIrhYL0w==::CEsSdimjuMPArCkx6QdFUMdlD+EZJITLGROsE1zvCjSxiu5/XjLFfCTHZcTtONgk2j05cFZOmCiy+sEErlLRZg==']
25-1431-00-1624203-1-1,Gobierno Autonomo Municipal De Sabaya,Contratación De Consultores De Línea – Personal Operativo Del G.A.M. Sabaya Gestión 2026,30/12/2025,05/01/2026,Vigente,"['OXfwC8LGPxgehFtJLhSWxw==::NvRzsRn/I0+0o+vxGcCQj441ZrcSKzffqxdXLKhUoveEZcQX6nn43HxemAJjkHWN6UvrhKLBKfxI1oV5tvE+Pg==', '1bD5bpyj6rB5i7YAz9Xkuw==::kD/ibE8TOcMzZyPGWA9pG4oeYrT11AN5KYXnzzEQ7WNdtuF+XKRKQ/Z2FoMGQAtOjyxDwrQsvAFqp7b0rGtiHw==', 'NKgWGJtUBxKJt0bgw6rGAA==::1kDQRIA63In87/IWpTp17crayL0Kr0Jjr+qiEKIvN2bKGuk0/4GiuA3R4k+sMdQzDJ9pynHcWU35hdOWX2z88A==']",['yVtLmTLaPnA2nDGAFQxutQ==::OUhzg4OfD/RsiwP3hXsvh0pujom3jMVPnuvy+MiqtQOv1LzKCDKzqXiiJdBu63LAfX/x/TJ3EDbseTK+EZ0H8w==']
25-0905-06-1624265-1-1,Servicio Departamental De Caminos - Potosi,Provision De Defensas Laterales Mas Terminales (Flex Beam) Proyecto: Construccion Camino Tratamiento Superficial Doble Uncia – Balneario – Cruce Chayanta,30/12/2025,08/01/2026,Vigente,"['6PKsAj8k4rcyt/z+sFnIzQ==::KNbRmOLxYOAu6LXUjzwWfc5xNn+kb7IDZuP2WeNkIErscmFKBmtoCfvkzOskrZtOqzTnothUW810jD+tNi0BKQ==', 'PC3lVY4zdAeAcf9CHb8rJQ==::X9jXAiIq6uAMjow70NTFjuPu/kmNKjVsPwKidqb1HnjsG79zuxZB7bRIB2T7ZmKSDCcatWZK2ATXs4GemdqoNA==']",['UmfVS0fUBb5mxTN8a7V/Yw==::A/6ngmnV2UdVR/+T5wJDNBCgErB9VLEjL7tPavqYxLXtiPJSXUyeWzAvDXW8oBwepJPiLa0o5on47LTDmxwetQ==']
25-0046-20-1619280-2-2,Seguro Social Universitario - La Paz,Contratación De Servicios Médicos Recurrentes En La Especialidad De Cardiología Gestión 2026 A Monto Fijo Para El Seguro Social Universitario La Paz - Ssu Lp,30/12/2025,07/01/2026,Vigente,"['fPGfwMG3QxWEHCepoBU1ug==::iJHeAH/6qqKq5Ft7JPWBUXqEQh6JH0rI+qFEPjjf5QV6BS2Zol2+Yj99b7xKgIxBc0AFAbR9xlXK5Rj+hdtxdw==', 'tiJeeWer0OM2/LpYMbZB4g==::54qusRZEJg025QmdBpj+Z6IQXOPaZhMpHwLfP058W53tMTqE05vyFB/4q0fUmoeNMlsLMtjEdv4t6IGvKSfbYw==']",['cIlIpdzcGPfEhTPEwn5KTA==::wV3K/M98XYX4Kv1QZomlJ3jVBWtXh8bQmue5igQRf+z06DoSj3h7WEMgCC3DmE84Dg3Y/izSsQBS74024+PuRg==']
25-0046-20-1618212-2-1,Seguro Social Universitario - La Paz,Contratación De Servicios Médicos Recurrentes En La Especialidad De Cirugia Pediatrica Para La Gestión 2026 A Monto Fijo Para El Seguro Social Universitario La Paz Ssu-Lp,30/12/2025,07/01/2026,Vigente,"['hGDN8+Ho55xZZgKUWqUgdw==::lItDnWkrZNGJCkcWJHGAgrdVZPli2ZTQTURxtrUOPRrUgPIq9IkgXrt/y6iPra5PkIbRVjtiDej7UBR1hQs66w==', 'uXB7Yt2ny0FLQS+FYPcfXQ==::N6hlbXOAdqdS/XdRob1BfH+Ygf4mtdXaUIm6fJCxTzRRarDn0BrN+4xT442c5QhMZmQLaw3qRUW7aY/0noC7HA==']",['MxGyUEjl/BEXLldF2panJA==::W3JvVYfmvEjIac9H6CS5dHgL4aiPKb8iSxutWXuq0BIuOx0JQGs0Vj1gx5HyyvYcrikHwOl8Tbc6txwUDBUn+g==']
25-1202-00-1621518-2-1,Gobierno Autonomo Municipal De Palca,Const. Casa Cultural Com. Arasaya (Adquisicion De Materiales) (Segunda Convocatoria),30/12/2025,07/01/2026,Vigente,"['VzrqtY+WOL2a7cEDI6uL0w==::cpBB2OAAAWak4J29nWi+wti+BdlxTUqq/xf/u+CYpsB0qJqGNIM378DvG0IuGJSSI8HtV2EsWmSVx+7Iu3a9DA==', '6ci3Bk0abRfDnoa/zqSDwA==::n9Zo71AJjxGsSJD1pHzmswgYOq8CFi7IHCzCbjKr7yZI2+g5RJlDxwS5tVekOayqrcWo++vx2kEbI9H0/+aG6g==']",['f79ct1xAfE8xKi9lgl/htg==::iN5g8ALHqGPKK4sErDRIvuB0tQ2WCCA7j5/qiEds/CGLu7H/NkoL04Z02V1GokxhRzJ3d8VRu3eRC6erCG5kXA==']
25-0905-06-1624258-1-1,Servicio Departamental De Caminos - Potosi,Provision De Materiales Para Señalizacion Horizontal Y Vertical Proyecto: Construccion Camino Tratamiento Superficial Doble Uncia – Balneario – Cruce Chayanta,30/12/2025,08/01/2026,Vigente,"['Yq7aWOCNq8kI8TS7B8M1ow==::7DHKGWYEmStjTMdJJ0Mg8OT5L5579RTCVSwDdBOPeLK+/u/EGNxbuiwytHFgjo3NjrxIZf8ECuk93fCGhdY2PQ==', 'skE5e0FxLVgNT7yP50LKlA==::R5owfjIbxEiRfCpLtacNoiOhEopixlfnPHH5F3MKpDFGqJt/yDR/0CO7psSIAT7PKSp8bu6DgdmhWCzVPSbFoA==']",['casvS3hCzi5x3OkxMYqMqQ==::0iWYySN16tzuC2E8am6Z7UMuUYnwWKNAL3TSHD1HZ2/pOL+q/X6nq+LMAv0I2qrz+iHV85WA/MnBfszKKyG9XA==']
25-0015-15-1623521-1-1,"Direccion De Apoyo A La Prevencion Del Consumo De Drogas, Control De Trafico Ilicito De Sustancias Controladas Y Coca Excedentaria - Diprevcon","Contratación Del Servicio De Atención Veterinaria Para Los Ejemplares Caninos Del Cioc K-9 Occidente Felcn, Para La Gestión 2026",30/12/2025,06/01/2026,Vigente,"['/5KYn/AUa5v1LotpF9f5HA==::2sVcc1YeqvDt5VZSB0T1+l4RpaoWHysvbpkKHlIMu0s9EHjCS1Kk5CjaqSfg/igr71HtpjFC2Ww4QHbai6Gm8Q==', 'A2qhdspbzOj8Ag6DBqdLLQ==::sp+5jiT+O4WL4rVvQEkOgiKZtUjGIcyzsDjQ3nhMndKuQonlrb8vaARrAlGMC7C2AJzHAfZ46cPFK6iq0308uQ==']",['S9plk2SxJ3eB4zIz3XgUqA==::qDvETnHknJJBxMaRws2VIfypHld+yOlNwXyXIaQMMvMLZ8N3rwRXd7C0Zu8ayD2HK/7sfA0uix+3H6nQz1HiCg==']
25-1105-00-1573012-5-1,Gobierno Autonomo Municipal De Tarvita (Villa Orias),Const. Sistema De Microriego Tecnificado Comunidad San Isidro (Tarvita),30/12/2025,21/01/2026,Vigente,"['hVWsAL4suez9m0+0yPx9CA==::acUkmSx62B0v53hwJNdK9itx3rrs1ivUSgzBnK9b9hdy7A50iJCofWnksxYdvXmMhftsihmIgOVsPcpMhqr9Gg==', 'sYawC0SXBCa5Ca3smkp7Fw==::mlqr13cTo9GkCGfCgf4K0VhqCFq9N0zkB+ojVrr6HuavJvQy2nu0DolXCdzHJWSRIQA8HJOYIgycrWF1lFjWzw==', 'aemSEoVcxgkmAQFS6pu3NA==::UbN3PCAmNM44/VX5H7hO7zmDkLgP5cxJ9DGRMyOdVW5WHGMW1QphyAVFFgEqMxgYFMjAY/t0nt8P6Dls4FEr4Q==', 'OzLVT787QL+pQtT8cORL6Q==::SCM+lOg+VqPnSxp5ChiRrCkpOBqflFLw5ZDL0PABcLuB9bWJOXqZF+Ab8s6wMSw4oieRVsFlPwBK/05WqwXrKw==']",['dq6G4puoi0plp6C569ygiQ==::rGsGjLC/apDs45ap5CTyt20C5KJxtovjdAemwMVGPC0oJnrBeErTlZ6TtDu70Xd0BlSMj2/Wr7sbwwAXOm4pxg==']
25-0078-00-1618591-2-2,Ministerio De Hidrocarburos Y Energias,Servicio De Limpieza Para El Ministerio De Hidrocarburos Y Energías- Gestión 2026,30/12/2025,14/01/2026,Vigente,"['qaiBUmRyah5xq50ks1osEQ==::re2rY5PF5Dlgm/LNU2XdBOUVFluMi4Hb9wm3Ece6fP1w5m5ERXAELOXTNoe3qofulK20gqRNrpPdMxpBKsTJuw==', 'xRHp9DdhlgfKYFzOggUJvA==::kyVPwrV2vHpuivNzg5i7Zq5Q5NZM0U5oW9Y0AIC5o/h19WufVksF6tEnyBQ8Q83kGP0oHZlFx9+ejcPWNGV39g==']",['63rxPDqeb6qwsoIfG8biUg==::Rju3ujL1T0NR58Z8DV8Q1+yYFmZF9/92iLnjqblrGqGSSBCdjj7OAnMYetqVvYPIS697CasgCOe41YbZ3cMnPQ==']
25-0291-03-1624250-1-1,Administradora Boliviana De Carreteras - Regional Potosi,Supervision De La Conser. Tramo Pt12 Cruce Cieneguillas – Lim. Deptal. Cbba. – Pto,30/12/2025,14/01/2026,Vigente,"['mCtoQel91eBk3l/eeJ3vZw==::RN76/X/uUVwCBGclIikwMCXaURJsQGYq/12qYOBmvWSoYHeu6taJcPehWQjGOdPUnLQ68wmtDSzg3C+zkj/0Zw==', 'jzN6OSoius+ohEGuvgeLHA==::eQYdjJUkebczo4OWt0dDAEsYCKeGoBnklDjDE2rrQCEkrDW0REyVUgTd2M3t6ThoCybtyfoKZpMp18xp0CEr2Q==']",['NCv7pAyRDPasqMF2dJ7V/A==::8tLBh6T4aREpeLmBiNG58f0DyvIFTXI1cd2/Y8n240/YwcoHlT8CB6blqrUSvz8Kt21i9Jqn+S1gpB4c6vm09A==']
25-0117-00-1612927-2-1,Direccion General De Aeronautica Civil,Servicio De Limpieza Para El Complejo Aeronautico (Instituto Nacional De Aviacion Civil) Gestion 2026,30/12/2025,08/01/2026,Vigente,"['c1q9TXutYksdRbwkBR40bQ==::SSPwP+j8a7b6AXUzBkovBAym/jRTJnZY9h8bWj3/FvEQoBZSEDmSQrFFBaWB7+TvFNh8Gik5RMiuX6zXkd7pew==', 'SqTZKPyCBZTSE3BE5uim2Q==::6TTeC35wGTvJsKPlb4IyoYwKNOzuW0/DAJRozmXel3WBvkEmkKkmTGTA+V6+fTL5g/C08nbWSu9baJnjHpyLlw==']",['KBZeI0EsbjW6wQM//XDtGQ==::+njVDOoM73kdVIV/KSWg+4GsJRHsT/wR1YDyZVVlNqr2+ZR08VKU31h8iA4ekpHZK0y3bs6vIEgO+5UIPl/16g==']
25-0015-01-1624248-1-1,Policia Boliviana,"Adquisicion De Frenos, Pastillas Y Balatas Para Los Vehiculos Y Motocicletas Del Cmdo. Dptal. De Policia De Chuquisaca, Correspondiente A La Gestion 2026",30/12/2025,05/01/2026,Vigente,"['TkMT/7rJu3369WMZ+MZ9iQ==::sXJJQyMKL7icacSWNAXRyK/g6vDmgJPsz9I2+cEaeHZZDvR4JFJA+rPqxfCPAc4kiCAXB2xe4RyP494gNUXZ9g==', 'M+mwEJLQJAhAXHfJchYpjQ==::IwkGJczMLUpwslfxdmlO6p+lbCpjQTk0mSow3Bz3mspncKF/Bf3Qb/JFn2QsfTzEHYChGnZ5wIFmVJMfLLNlPQ==']",['1MgiWmM7fLKAifYeWwCdGQ==::a7ZC/s3Db0ltqOtakFIdSs3PCkGgicFBNRCmqi09tc/+mzkdudmHP2DDmlU4p33gznG7VhovShF3hzDNiDvXsg==']
25-1704-00-1624016-1-1,Gobierno Autonomo Municipal De La Guardia,Adquisicion De Insumos Para Farmacia Para Los Centros De Salud Del Municipio De La Guardia Primer Trimestre Gestion 2026,30/12/2025,14/01/2026,Vigente,"['B7+0WLpkCEdYXRJySHTb9g==::qu4KXUNYL0YkXj9keikVSetACulcjhTYkmYN451FagyyXuAcQVO7RoWZF0r6q31pexHolbuV1yyqk2rLDsBttA==', 'j8RblQ1ZKiA/d1/fHofJCA==::E8QTvdzFzTDV5ejreIoDhvEfQnW2Wm6RDDOBnvL9u/SAfGvbleg1L7RBRFA8D2/W1uweTJUG8Up8EgbgUUjsxg==']",['+zW8oYgk03LDrPt5YgvFtQ==::zsEYaR/zfx8CzDrXsleK6HiTZw3JpgBbUv99SwZFrbScY1A6HIxoGXzN3OuuC5L4uITL/tSls5/RCCl47BIadg==']
25-1103-00-1602025-3-1,Gobierno Autonomo Municipal De Poroma,“Construcción Área Etnoecoturística En El Municipio De Poroma”,30/12/2025,23/01/2026,Vigente,"['jNBYBE3kchwn603os0DENA==::sDU5514xM6Y/wNazzQR8iOosizX859FD1GtxHGf+nE3yattxSj4VW8EUNIz/akcpTwCF9wMig7IvziJuzuS4jA==', 'TO7RGd9iB/AUdEV21pi1fg==::c3kR2OIR/drNBwOsKDrn9yyE1AehMRrU7OR/mbdwqpX5ljM5bG4sPBOL7i7rokTX1kFU8HbMbpL5JE19Fx6rhA==', 'xhTcO994F5gdF2R1pikhww==::QDjbKcaeffPodp0isrAQI2DApUw4mE4ojqQ8buZagI/L7uDJa4Bh1G0zEUMOcBQ41dVZqOJuO+cSENxPXzakGg==', 'gC7oIxYeBMZ/ksmaFDbymw==::a1IAT03dU88wK/Bsfdx7k+Kp5Sd+pacxUE4M/8bUPwF6zMYGspw4ua0/RZSHau72Xso5y8jBitdvUVo9KimHVQ==', 'p4bKwYXcIQqU8UvjEALltw==::AF0g9/d+dPbOELxFsV+zpdawr6mOo4y+mZyhNOB945ERRRq3ic79OxAUEgV8DwBhcZPpaL485bi9B7wwCO12WQ==', '0WN+vFljLtL5Tgo+Sx/J6w==::VtYFBGseqy6EFtQvyDsrRjOgXQmZ/yFkbg2AXNOcjZ4N8AdRoVL3xcaTzOkD0a++JHlNLLtvbug/BY+EzQnmFw==', 'cHIVYJyZGP8w/267GQ4Rjw==::kKYfh8PQGGHEgS5/sFlddfUGH4D72HAsCPCDIHh1D19T0OOYy+4UUTYE+HrLomJy/BOE+uTuevihz0Zu7rVczA==', 'QRygxW+mqsD9EupRZ+HreA==::UnIaQ3A6SZz01cgcZ784LCRZONo0GHoruCTkcszvkigXWOS4rNyAEUM+Sts4Zd3XW3mTzRPsfFK02ckXxQGfWw==']",['nnLKM67OiO874IyfCeAEmw==::5fONo2xvKc89dcKKuHWLN1lDK6jX8hIIAcJL3o+leTrEYNZKwfsqaVbtpFc1ENKQHI8FM/QWsdn6iualM4oscA==']
25-1704-00-1624080-1-1,Gobierno Autonomo Municipal De La Guardia,Servicio De Mantenimiento Correctivo Y Preventivo Para Motocicletas Del Gam La Guardia 1er Semestre Gestión 2026,30/12/2025,08/01/2026,Vigente,"['gFc1WPqRhUYpK4OkNON8/A==::++E2QNMrWvgefAPL1tWeeb8CI7iXHwkU20LLBMEuxKkg27qnUWs8Sh4jsXHw+J3c3xKgQzSyM+bCx5lrdROCIQ==', '9iJx6cOWBO+6bW7wjFZqrw==::oOB3E1mlUr4nEsChph76qMZC4DET1Zau+eHYs8oO9QRLqUFJYD3iic9FjzD7xlF+e61YmDq4eUuJTx0IuPPDEw==']",['YxZAtqVUiJRjDOQjBN8ChQ==::EF/INwzZyE7udqP1nKIUjQjYB8CxJWZTkj3wsUGfNzUJaEIjL/pIgcblVyX7kMbbtjZSTDkCiFKgPVw9nyMggg==']
25-1406-00-1624190-1-1,Gobierno Autonomo Municipal De Huanuni (Villa Huanuni),Supervisión Tecnica Proyecto: Ampl. Centro De Salud Huayrapata Municipio De Huanuni,30/12/2025,07/01/2026,Vigente,"['6h7EN7mDpBqQAKIglAHj4g==::NgiArDi65t5OFXzVy1UM4xwIXDZc4vVKx/OoFcxte05q2HhW1lTlrv8WUaRAUZ7iAmmLICAuVBLRLfsqGNce6A==', 'Qdi9LBcWGWFtR9MC7WyLfg==::46AnJ4zBk+wZV4BiZ9KHHPZHNTyXE6AgWX1qXuDybHGzpn3m/wTZu4F7EQtzqcKkNHkzuqrsf8Hyh2mMAlzFJQ==']",['c2XGTZi9cxIQZcAyVursvg==::sa85BvMeMRlsqY0ybhkEJ4jvItiKAXubsPnaQq38lFgI2TLOhy8n1fHI5RANr+NJsns3r/caJbzZm801rOQsqg==']
